{
  "schema_version": "operator-decision.v1",
  "decision": "validate",
  "job_id": "job-001",
  "claims": [
    {
      "claim_id": "claim-001",
      "verdict": "fail",
      "confidence_basis_points": 8200,
      "evidence_refs": ["evidence-001"]
    }
  ],
  "resource_report": {
    "model_calls": 2,
    "tool_calls": 18
  }
}
